{
  "schema_version": 1,
  "diagram_type": "dataflow",
  "meta": {
    "title": "Automatic label and route clearance",
    "locale": "zh-CN",
    "output": "diagram.html",
    "quality_profile": "showcase"
  },
  "stages": [
    {
      "label": "文文文文文"
    },
    {
      "label": "文文文文文"
    },
    {
      "label": "文文文文文"
    },
    {
      "label": "文文文文文"
    },
    {
      "label": "文文文文文"
    }
  ],
  "nodes": [
    {
      "id": "n00",
      "type": "backend",
      "label": "aaa_aa_aaaa",
      "sublabel": "aaa · aaaaaa · NNN",
      "stage": 0,
      "row": 0
    },
    {
      "id": "n01",
      "type": "backend",
      "label": "aaa(aaa)",
      "sublabel": "N1 文文；文文 N1",
      "stage": 1,
      "row": 0
    },
    {
      "id": "n02",
      "type": "backend",
      "label": "N1 文文",
      "sublabel": "文文 NaaaaNaaaaaa",
      "stage": 1,
      "row": 1
    },
    {
      "id": "n03",
      "type": "backend",
      "label": "N1 文文",
      "sublabel": "文文 NaaaaNaaaaaa",
      "stage": 2,
      "row": 0
    },
    {
      "id": "n04",
      "type": "backend",
      "label": "文文 aaaaa",
      "sublabel": "文文文文文文文",
      "stage": 4,
      "row": 0
    },
    {
      "id": "n05",
      "type": "backend",
      "label": "aaaaaa-aaaaaa",
      "sublabel": "文 aaa 文文 Naaaaa",
      "stage": 0,
      "row": 2
    },
    {
      "id": "n06",
      "type": "backend",
      "label": "文文文 Naaaaa",
      "sublabel": "aaaaaa 文文；文文文文",
      "stage": 0,
      "row": 3
    },
    {
      "id": "n07",
      "type": "backend",
      "label": "文文文文文",
      "sublabel": "文文 NaaaaaaNaaaaNaaaaaa",
      "stage": 1,
      "row": 2
    },
    {
      "id": "n08",
      "type": "backend",
      "label": "aaaaaaa_aaaa",
      "sublabel": "NNNN aaaaa · NNN",
      "stage": 2,
      "row": 2
    },
    {
      "id": "n09",
      "type": "backend",
      "label": "文文 aaa(aaa)",
      "sublabel": "文 aaaaa，文文 N1/N1",
      "stage": 3,
      "row": 2
    },
    {
      "id": "n10",
      "type": "backend",
      "label": "aaaaa aaaaaa()",
      "sublabel": "文文文文文文文",
      "stage": 2,
      "row": 3
    },
    {
      "id": "n11",
      "type": "backend",
      "label": "aaa(aaa,aaaaa,NNN)",
      "sublabel": "文文 N1，文文文 N1",
      "stage": 3,
      "row": 3
    },
    {
      "id": "n12",
      "type": "backend",
      "label": "文文文文 Naaaaa",
      "sublabel": "aaa_aaaaaa；aaaaaaa 文文",
      "stage": 4,
      "row": 3
    },
    {
      "id": "n13",
      "type": "backend",
      "label": "文文文文",
      "sublabel": "aaa_aaaaaaaaa；aaaaaaa 文文",
      "stage": 4,
      "row": 4
    },
    {
      "id": "n14",
      "type": "backend",
      "label": "aaaaaaa_aaaa",
      "sublabel": "文文文文文文文文；aaaaaaa",
      "stage": 3,
      "row": 4
    }
  ],
  "flows": [
    {
      "id": "f1",
      "from": "n00",
      "to": "n01",
      "label": "aaa",
      "variant": "default",
      "classification": "文文文文文文"
    },
    {
      "id": "f2",
      "from": "n02",
      "to": "n01",
      "label": "N1 文文文",
      "variant": "default",
      "classification": "文文文文文文"
    },
    {
      "id": "f3",
      "from": "n01",
      "to": "n03",
      "label": "N1 文文文",
      "variant": "dashed",
      "classification": "文文文文"
    },
    {
      "id": "f4",
      "from": "n03",
      "to": "n01",
      "label": "N1 文文文",
      "variant": "default",
      "classification": "文文文文文文"
    },
    {
      "id": "f5",
      "from": "n01",
      "to": "n02",
      "label": "N1 文文文",
      "variant": "default",
      "classification": "文文文文文文"
    },
    {
      "id": "f6",
      "from": "n01",
      "to": "n04",
      "label": "文文文",
      "variant": "default",
      "classification": "文文文文文文"
    },
    {
      "id": "f7",
      "from": "n01",
      "to": "n05",
      "label": "文文文",
      "variant": "dashed",
      "classification": "文文文文"
    },
    {
      "id": "f8",
      "from": "n05",
      "to": "n06",
      "label": "文文 Naaaaa",
      "variant": "dashed",
      "classification": "文文文文"
    },
    {
      "id": "f9",
      "from": "n05",
      "to": "n07",
      "label": "文文文 aaaaa",
      "variant": "dashed",
      "classification": "文文文文"
    },
    {
      "id": "f10",
      "from": "n07",
      "to": "n10",
      "label": "文文文文",
      "variant": "dashed",
      "classification": "文文文文"
    },
    {
      "id": "f11",
      "from": "n07",
      "to": "n08",
      "label": "文文文文文",
      "variant": "dashed",
      "classification": "文文文文"
    },
    {
      "id": "f12",
      "from": "n08",
      "to": "n10",
      "label": "文文文文文文",
      "variant": "dashed",
      "classification": "文文文文"
    },
    {
      "id": "f13",
      "from": "n08",
      "to": "n09",
      "label": "文文文文",
      "variant": "dashed",
      "classification": "文文文文"
    },
    {
      "id": "f14",
      "from": "n09",
      "to": "n01",
      "label": "文文 aaa",
      "variant": "default",
      "classification": "文文文文文文"
    },
    {
      "id": "f15",
      "from": "n01",
      "to": "n09",
      "label": "文文文文文文",
      "variant": "default",
      "classification": "文文文文文文"
    },
    {
      "id": "f16",
      "from": "n09",
      "to": "n12",
      "label": "文文文文文",
      "variant": "default",
      "classification": "文文文文文文"
    },
    {
      "id": "f17",
      "from": "n09",
      "to": "n10",
      "label": "文文文文文文",
      "variant": "dashed",
      "classification": "文文文文"
    },
    {
      "id": "f18",
      "from": "n10",
      "to": "n11",
      "label": "aaaaaa 文文",
      "variant": "default",
      "classification": "文文文文文文"
    },
    {
      "id": "f19",
      "from": "n11",
      "to": "n02",
      "label": "aaaaa · NNN",
      "variant": "default",
      "classification": "文文文文文文"
    },
    {
      "id": "f20",
      "from": "n11",
      "to": "n03",
      "label": "N1 文文文",
      "variant": "dashed",
      "classification": "文文文文"
    },
    {
      "id": "f21",
      "from": "n11",
      "to": "n12",
      "label": "文文文 aaaaa",
      "variant": "default",
      "classification": "文文文文文文"
    },
    {
      "id": "f22",
      "from": "n12",
      "to": "n06",
      "label": "文文 aaaaa",
      "variant": "default",
      "classification": "文文文文文文"
    },
    {
      "id": "f23",
      "from": "n12",
      "to": "n04",
      "label": "aaaaa 文 aaaaa",
      "variant": "default",
      "classification": "文文文文文文"
    },
    {
      "id": "f24",
      "from": "n06",
      "to": "n04",
      "label": "文文文文 aaaaa",
      "variant": "default",
      "classification": "文文文文文文"
    },
    {
      "id": "f25",
      "from": "n10",
      "to": "n13",
      "label": "aaaaaa 文文",
      "variant": "dashed",
      "classification": "文文文文"
    },
    {
      "id": "f26",
      "from": "n11",
      "to": "n13",
      "label": "N1 文文文",
      "variant": "dashed",
      "classification": "文文文文"
    },
    {
      "id": "f27",
      "from": "n13",
      "to": "n06",
      "label": "文文文文",
      "variant": "dashed",
      "classification": "文文文文"
    },
    {
      "id": "f28",
      "from": "n08",
      "to": "n14",
      "label": "文文文文文文",
      "variant": "dashed",
      "classification": "文文文文"
    }
  ]
}
